geoid,name,pop
0600000US0900108070,"Bridgeport town, Fairfield County, Connecticut",85679
0600000US0900118500,"Danbury town, Fairfield County, Connecticut",56977
0600000US0900156060,"Norwalk town, Fairfield County, Connecticut",60668
0600000US0900173070,"Stamford town, Fairfield County, Connecticut",80714
0600000US0900337070,"Hartford town, Hartford County, Connecticut",79955
0600000US0900350440,"New Britain town, Hartford County, Connecticut",51589
0600000US0900952070,"New Haven town, New Haven County, Connecticut",89986
0600000US0900980070,"Waterbury town, New Haven County, Connecticut",75084
0600000US1701912411,"Champaign City township, Champaign County, Illinois",66531
0600000US1703106561,"Bloom township, Cook County, Illinois",61493
0600000US1703107939,"Bremen township, Cook County, Illinois",77052
0600000US1703114000,"Chicago city, Cook County, Illinois",1872121
0600000US1703114364,"Cicero township, Cook County, Illinois",42516
0600000US1703123243,"Elk Grove township, Cook County, Illinois",59711
0600000US1703124582,"Evanston city, Cook County, Illinois",52137
0600000US1703132694,"Hanover township, Cook County, Illinois",58678
0600000US1703143120,"Leyden township, Cook County, Illinois",57108
0600000US1703145447,"Lyons township, Cook County, Illinois",76096
0600000US1703146162,"Maine township, Cook County, Illinois",98792
0600000US1703153013,"Niles township, Cook County, Illinois",71225
0600000US1703153676,"Northfield township, Cook County, Illinois",60808
0600000US1703156614,"Orland township, Cook County, Illinois",75721
0600000US1703157238,"Palatine township, Cook County, Illinois",69459
0600000US1703162133,"Proviso township, Cook County, Illinois",100828
0600000US1703163498,"Rich township, Cook County, Illinois",60354
0600000US1703168016,"Schaumburg township, Cook County, Illinois",86389
0600000US1703175198,"Thornton township, Cook County, Illinois",120728
0600000US1703181100,"Wheeling township, Cook County, Illinois",97378
0600000US1703183531,"Worth township, Cook County, Illinois",108276
0600000US1704300250,"Addison township, DuPage County, Illinois",61111
0600000US1704306600,"Bloomingdale township, DuPage County, Illinois",75125
0600000US1704320604,"Downers Grove township, DuPage County, Illinois",108847
0600000US1704343952,"Lisle township, DuPage County, Illinois",83291
0600000US1704349451,"Milton township, DuPage County, Illinois",83444
0600000US1704351635,"Naperville township, DuPage County, Illinois",67294
0600000US1704379410,"Wayne township, DuPage County, Illinois",48083
0600000US1704383947,"York township, DuPage County, Illinois",89933
0600000US1708903025,"Aurora township, Kane County, Illinois",89947
0600000US1708921046,"Dundee township, Kane County, Illinois",41687
0600000US1708923087,"Elgin township, Kane County, Illinois",71255
0600000US1709703220,"Avon township, Lake County, Illinois",42766
0600000US1709777668,"Vernon township, Lake County, Illinois",43427
0600000US1709778877,"Warren township, Lake County, Illinois",43041
0600000US1709779306,"Waukegan township, Lake County, Illinois",49037
0600000US1711100698,"Algonquin township, McHenry County, Illinois",64045
0600000US1711306639,"Bloomington City township, McLean County, Illinois",54989
0600000US1714359013,"Peoria City township, Peoria County, Illinois",75113
0600000US1716711046,"Capital township, Sangamon County, Illinois",86010
0600000US1719721241,"Du Page township, Will County, Illinois",59620
0600000US1719738583,"Joliet township, Will County, Illinois",50999
0600000US1719760300,"Plainfield township, Will County, Illinois",55767
0600000US1719781035,"Wheatland township, Will County, Illinois",57061
0600000US1720165013,"Rockford township, Winnebago County, Illinois",120494
0600000US1800366924,"St. Joseph township, Allen County, Indiana",55266
0600000US1800381620,"Wayne township, Allen County, Indiana",76108
0600000US1803511296,"Center township, Delaware County, Indiana",57105
0600000US1805713060,"Clay township, Hamilton County, Indiana",69744
0600000US1808909820,"Calumet township, Lake County, Indiana",72721
0600000US1808954414,"North township, Lake County, Indiana",111331
0600000US1808966870,"St. John township, Lake County, Indiana",52945
0600000US1809711512,"Center township, Marion County, Indiana",115075
0600000US1809742444,"Lawrence township, Marion County, Indiana",92828
0600000US1809759058,"Perry township, Marion County, Indiana",79430
0600000US1809759742,"Pike township, Marion County, Indiana",56606
0600000US1809780144,"Warren township, Marion County, Indiana",76608
0600000US1809780792,"Washington township, Marion County, Indiana",105805
0600000US1809781800,"Wayne township, Marion County, Indiana",89856
0600000US1814158734,"Penn township, St. Joseph County, Indiana",50859
0600000US1814161128,"Portage township, St. Joseph County, Indiana",64952
0600000US1815779352,"Wabash township, Tippecanoe County, Indiana",49815
0600000US1816340212,"Knight township, Vanderburgh County, Indiana",50645
0600000US2004538900,"Lawrence city, Douglas County, Kansas",75054
0600000US2009152575,"Olathe city, Johnson County, Kansas",93973
0600000US2009153775,"Overland Park city, Johnson County, Kansas",140422
0600000US2009164500,"Shawnee city, Johnson County, Kansas",48349
0600000US2017379000,"Wichita city, Sedgwick County, Kansas",272074
0600000US2017771000,"Topeka city, Shawnee County, Kansas",95273
0600000US2020936000,"Kansas City city, Wyandotte County, Kansas",91907
0600000US2300560545,"Portland city, Cumberland County, Maine",55886
0600000US2500523000,"Fall River city, Bristol County, Massachusetts",63216
0600000US2500545000,"New Bedford city, Bristol County, Massachusetts",63933
0600000US2500934550,"Lawrence city, Essex County, Massachusetts",45447
0600000US2500937490,"Lynn city, Essex County, Massachusetts",53232
0600000US2501367000,"Springfield city, Hampden County, Massachusetts",109071
0600000US2501711000,"Cambridge city, Middlesex County, Massachusetts",85649
0600000US2501724960,"Framingham city, Middlesex County, Massachusetts",44298
0600000US2501737000,"Lowell city, Middlesex County, Massachusetts",81561
0600000US2501745560,"Newton city, Middlesex County, Massachusetts",63971
0600000US2501762535,"Somerville city, Middlesex County, Massachusetts",59608
0600000US2502155745,"Quincy city, Norfolk County, Massachusetts",66741
0600000US2502309000,"Brockton city, Plymouth County, Massachusetts",62587
0600000US2502507000,"Boston city, Suffolk County, Massachusetts",496231
0600000US2502782000,"Worcester city, Worcester County, Massachusetts",129079
0600000US2604929000,"Flint city, Genesee County, Michigan",70707
0600000US2606546000,"Lansing city, Ingham County, Michigan",82132
0600000US2607742160,"Kalamazoo city, Kalamazoo County, Michigan",58536
0600000US2608134000,"Grand Rapids city, Kent County, Michigan",143988
0600000US2608188940,"Wyoming city, Kent County, Michigan",54570
0600000US2609916520,"Clinton charter township, Macomb County, Michigan",77167
0600000US2609950480,"Macomb township, Macomb County, Michigan",66050
0600000US2609972820,"Shelby charter township, Macomb County, Michigan",58887
0600000US2609976460,"Sterling Heights city, Macomb County, Michigan",100530
0600000US2609984000,"Warren city, Macomb County, Michigan",99572
0600000US2612527440,"Farmington Hills city, Oakland County, Michigan",55386
0600000US2612569035,"Rochester Hills city, Oakland County, Michigan",53727
0600000US2612574900,"Southfield city, Oakland County, Michigan",57066
0600000US2612580700,"Troy city, Oakland County, Michigan",57574
0600000US2612584240,"Waterford charter township, Oakland County, Michigan",57936
0600000US2612585480,"West Bloomfield charter township, Oakland County, Michigan",47859
0600000US2616103000,"Ann Arbor city, Washtenaw County, Michigan",89758
0600000US2616313120,"Canton charter township, Wayne County, Michigan",64457
0600000US2616321000,"Dearborn city, Wayne County, Michigan",57707
0600000US2616322000,"Detroit city, Wayne County, Michigan",482693
0600000US2616349000,"Livonia city, Wayne County, Michigan",73903
0600000US2616386000,"Westland city, Wayne County, Michigan",61572
0600000US2700306382,"Blaine city, Anoka County, Minnesota",45064
0600000US2703717288,"Eagan city, Dakota County, Minnesota",43316
0600000US2703735180,"Lakeville city, Dakota County, Minnesota",46963
0600000US2705306616,"Bloomington city, Hennepin County, Minnesota",66250
0600000US2705307966,"Brooklyn Park city, Hennepin County, Minnesota",54726
0600000US2705340166,"Maple Grove city, Hennepin County, Minnesota",52513
0600000US2705343000,"Minneapolis city, Hennepin County, Minnesota",316435
0600000US2705351730,"Plymouth city, Hennepin County, Minnesota",54524
0600000US2710954880,"Rochester city, Olmsted County, Minnesota",83447
0600000US2712358000,"St. Paul city, Ramsey County, Minnesota",209348
0600000US2713717000,"Duluth city, St. Louis County, Minnesota",69809
0600000US2716371428,"Woodbury city, Washington County, Minnesota",51008
0600000US2901915688,"Columbia township, Boone County, Missouri",57306
0600000US2902177236,"Washington township, Buchanan County, Missouri",59498
0600000US2904726290,"Gallatin township, Clay County, Missouri",58421
0600000US2907770009,"Springfield township, Greene County, Missouri",135058
0600000US2909506490,"Blue township, Jackson County, Missouri",114786
0600000US2909508686,"Brooking township, Jackson County, Missouri",55146
0600000US2909538054,"Kaw township, Jackson County, Missouri",146962
0600000US2909559564,"Prairie township, Jackson County, Missouri",78632
0600000US2909568438,"Sni-A-Bar township, Jackson County, Missouri",61918
0600000US2909577506,"Washington township, Jackson County, Missouri",50077
0600000US2951065000,"St. Louis city, St. Louis city, Missouri",232756
0600000US3105592237,"Omaha city, Douglas County, Nebraska",328815
0600000US3110991753,"Lincoln city, Lancaster County, Nebraska",214362
0600000US3301145140,"Manchester city, Hillsborough County, New Hampshire",85554
0600000US3301150260,"Nashua city, Hillsborough County, New Hampshire",67833
0600000US3400710000,"Camden city, Camden County, New Jersey",46160
0600000US3400712280,"Cherry Hill township, Camden County, New Jersey",53527
0600000US3400726760,"Gloucester township, Camden County, New Jersey",49629
0600000US3401319390,"East Orange city, Essex County, New Jersey",44419
0600000US3401351000,"Newark city, Essex County, New Jersey",160087
0600000US3401703580,"Bayonne city, Hudson County, New Jersey",44372
0600000US3401736000,"Jersey City city, Hudson County, New Jersey",155099
0600000US3401774630,"Union City city, Hudson County, New Jersey",37101
0600000US3402129310,"Hamilton township, Mercer County, New Jersey",64434
0600000US3402174000,"Trenton city, Mercer County, New Jersey",47437
0600000US3402320230,"Edison township, Middlesex County, New Jersey",55812
0600000US3402354705,"Old Bridge township, Middlesex County, New Jersey",49182
0600000US3402382000,"Woodbridge township, Middlesex County, New Jersey",66095
0600000US3402545990,"Middletown township, Monmouth County, New Jersey",51889
0600000US3402907420,"Brick township, Ocean County, New Jersey",60402
0600000US3402938550,"Lakewood township, Ocean County, New Jersey",45239
0600000US3402973125,"Toms River township, Ocean County, New Jersey",70980
0600000US3403113690,"Clifton city, Passaic County, New Jersey",54125
0600000US3403156550,"Passaic city, Passaic County, New Jersey",31205
0600000US3403157000,"Paterson city, Passaic County, New Jersey",76236
0600000US3403524900,"Franklin township, Somerset County, New Jersey",48664
0600000US3403921000,"Elizabeth city, Union County, New Jersey",60543
0600000US3600101000,"Albany city, Albany County, New York",74976
0600000US3600117343,"Colonie town, Albany County, New York",65227
0600000US3600508510,"Bronx borough, Bronx County, New York",860883
0600000US3602902000,"Amherst town, Erie County, New York",94051
0600000US3602911000,"Buffalo city, Erie County, New York",184368
0600000US3602915011,"Cheektowaga town, Erie County, New York",68919
0600000US3602975000,"Tonawanda town, Erie County, New York",61187
0600000US3604710022,"Brooklyn borough, Kings County, New York",1666176
0600000US3605530290,"Greece town, Monroe County, New York",75906
0600000US3605563000,"Rochester city, Monroe County, New York",153987
0600000US3605934000,"Hempstead town, Nassau County, New York",543478
0600000US3605953000,"North Hempstead town, Nassau County, New York",160572
0600000US3605956000,"Oyster Bay town, Nassau County, New York",226676
0600000US3606144919,"Manhattan borough, New York County, New York",1203078
0600000US3606773000,"Syracuse city, Onondaga County, New York",105669
0600000US3608160323,"Queens borough, Queens County, New York",1388231
0600000US3608570915,"Staten Island borough, Richmond County, New York",339044
0600000US3608715968,"Clarkstown town, Rockland County, New York",66096
0600000US3608760510,"Ramapo town, Rockland County, New York",68816
0600000US3609365508,"Schenectady city, Schenectady County, New York",48725
0600000US3610304000,"Babylon town, Suffolk County, New York",156773
0600000US3610310000,"Brookhaven town, Suffolk County, New York",353581
0600000US3610337000,"Huntington town, Suffolk County, New York",151847
0600000US3610338000,"Islip town, Suffolk County, New York",230809
0600000US3610368000,"Smithtown town, Suffolk County, New York",91727
0600000US3611930367,"Greenburgh town, Westchester County, New York",64531
0600000US3611949121,"Mount Vernon city, Westchester County, New York",50049
0600000US3611950617,"New Rochelle city, Westchester County, New York",54601
0600000US3611984000,"Yonkers city, Westchester County, New York",132680
0600000US3801507200,"Bismarck city, Burleigh County, North Dakota",56695
0600000US3801725700,"Fargo city, Cass County, North Dakota",92798
0600000US3903516000,"Cleveland city, Cuyahoga County, Ohio",285935
0600000US3903561000,"Parma city, Cuyahoga County, Ohio",61321
0600000US3904918000,"Columbus city, Franklin County, Ohio",632187
0600000US3906115000,"Cincinnati city, Hamilton County, Ohio",230374
0600000US3909344856,"Lorain city, Lorain County, Ohio",46493
0600000US3909577000,"Toledo city, Lucas County, Ohio",206158
0600000US3909988000,"Youngstown city, Mahoning County, Ohio",51193
0600000US3911321000,"Dayton city, Montgomery County, Ohio",104919
0600000US3915112000,"Canton city, Stark County, Ohio",53122
0600000US3915301000,"Akron city, Summit County, Ohio",150905
0600000US4200361000,"Pittsburgh city, Allegheny County, Pennsylvania",239526
0600000US4201163624,"Reading city, Berks County, Pennsylvania",57454
0600000US4204579000,"Upper Darby township, Delaware County, Pennsylvania",56087
0600000US4204924000,"Erie city, Erie County, Pennsylvania",72304
0600000US4206969000,"Scranton city, Lackawanna County, Pennsylvania",59219
0600000US4207702000,"Allentown city, Lehigh County, Pennsylvania",81450
0600000US4210160000,"Philadelphia city, Philadelphia County, Pennsylvania",1147538
0600000US4400374300,"Warwick city, Kent County, Rhode Island",65150
0600000US4400719180,"Cranston city, Providence County, Rhode Island",61529
0600000US4400754640,"Pawtucket city, Providence County, Rhode Island",49757
0600000US4400759000,"Providence city, Providence County, Rhode Island",120511
0600000US4609959020,"Sioux Falls city, Minnehaha County, South Dakota",111790
0600000US4610352980,"Rapid City city, Pennington County, South Dakota",59479
0600000US5500931000,"Green Bay city, Brown County, Wisconsin",74728
0600000US5502548000,"Madison city, Dane County, Wisconsin",202756
0600000US5503522300,"Eau Claire city, Eau Claire County, Wisconsin",53798
0600000US5505939225,"Kenosha city, Kenosha County, Wisconsin",72537
0600000US5507953000,"Milwaukee city, Milwaukee County, Wisconsin",404940
0600000US5510166000,"Racine city, Racine County, Wisconsin",54787
0600000US5513384250,"Waukesha city, Waukesha County, Wisconsin",55433
0600000US5513960500,"Oshkosh city, Winnebago County, Wisconsin",53251
